Data;Conta Contabil;Descricao Conta;Historico;Documento;Valor
01/06/2026;2.1.1.001;Fornecedores a Pagar;PIX ENVIADO FORNECEDOR ABC MATERIAIS LTDA;12345;-1500,00
02/06/2026;3.1.1.001;Receita de Vendas;TED RECEBIDO CLIENTE XYZ COMERCIO;98765;3200,50
03/06/2026;4.1.2.010;Despesas Bancarias;TARIFA MANUTENCAO CONTA CORRENTE;;-35,90
05/06/2026;4.1.3.020;Despesas com Combustivel;PIX POSTO COMBUSTIVEL SILVA;22222;-420,00
07/06/2026;4.1.4.030;Despesas com Aluguel;PAGAMENTO BOLETO ALUGUEL IMOVEL COMERCIAL;55501;-2800,00
15/06/2026;4.1.5.040;Servicos de Consultoria;PIX JOAO DA SILVA CONSULTORIA;33344;-650,00
20/06/2026;4.1.2.010;Despesas Bancarias;TARIFA TED;;-15,00
